Codificació;denominaci;Departament;membre;c_rrec_en_l_rgan_de_govern_superior;c_rrec_o_lloc_de_treball;SAC.carrec;SAC.codi_d_informaci;rgan_que_designa;SAC;nom_1;Observacions
Agència per a la Qualitat del Sistema Universitari de CatalunyaPersones del departament competent en matèria d’universitats, nomenades pel conseller corresponentDirector general d'Universitats;Agència per a la Qualitat del Sistema Universitari de Catalunya;REU - Departament de Recerca i Universitats;Persones del departament competent en matèria d’universitats, nomenades pel conseller corresponent;Membre;Director general d'Universitats;director general d'Universitats;131;;director general d'Universitats;Miquel Soriano Ibañez;
Escola d'Administració Pública de CatalunyaEl/la director/a general d'UniversitatsDirector general d'Universitats;Escola d'Administració Pública de Catalunya;PRE - Departament de la Presidència;El/la director/a general d'Universitats;Vocal;Director general d'Universitats;director general d'Universitats;131;;director general d'Universitats;Miquel Soriano Ibañez;
Consorci de Serveis Universitaris de Catalunya (CSUC)Membre nomenat pel conseller/a del departament competent en matèria d'universitatsDirector general d'Universitats;Consorci de Serveis Universitaris de Catalunya (CSUC);REU - Departament de Recerca i Universitats;Membre nomenat pel conseller/a del departament competent en matèria d'universitats;Membre;Director general d'Universitats;director general d'Universitats;131;Conseller d'Empresa i Coneixement;director general d'Universitats;Miquel Soriano Ibañez;
Consorci de Comerç, Artesania i Moda de CatalunyaEl director/a del Consorci de Comerç, Artesania i Moda de Catalunya, amb veu i sense votDirector del Consorci de Comerç, Artesania i Moda de Catalunya;Consorci de Comerç, Artesania i Moda de Catalunya;EMT - Departament d'Empresa i Treball;El director/a del Consorci de Comerç, Artesania i Moda de Catalunya, amb veu i sense vot;Vocal;Director del Consorci de Comerç, Artesania i Moda de Catalunya;director del Consorci de Comerç, Artesania i Moda de Catalunya;17437;;Consorci de Comerç, Artesania i Moda de Catalunya (CCAM);Moisés Rodríguez Cantón;
Consorci de Serveis Socials de BarcelonaPresident/a que serà el conseller/a de Drets SocialsConsellera de Drets Socials i Inclusió;Consorci de Serveis Socials de Barcelona;DSI - Departament de Drets Socials i Inclusió;President/a que serà el conseller/a de Drets Socials;President/a;Consellera de Drets Socials i Inclusió;consellera de Drets Socials i Inclusió;19774;;consellera de Drets Socials i Inclusió;Mónica Martínez Bravo;
Fundació Catalana per a l'Ensenyament de l'Idioma Anglès i l'Educació en AnglèsLa persona titular de la DG Generalitat competent en matèria de centres educatius no universitarisDirectora general de Centres Públics;Fundació Catalana per a l'Ensenyament de l'Idioma Anglès i l'Educació en Anglès;ECF - Departament d'Economia i Finances;La persona titular de la DG Generalitat competent en matèria de centres educatius no universitaris;Membre;Directora general de Centres Públics;Directora general de Centres Públics;18121;;Direcció General de Centres Públics;Montserrat Duran Tauleria;
Consorci Parc de Recerca Biomèdica de Barcelona (PRBB)Representant de la Generalitat designat pel titular del departament competent en matèria de salutSubdirectora general de Recerca i Innovació en Salut;Consorci Parc de Recerca Biomèdica de Barcelona (PRBB);REU - Departament de Recerca i Universitats;Representant de la Generalitat designat pel titular del departament competent en matèria de salut;Vocal;Subdirectora general de Recerca i Innovació en Salut;subdirectora general de Recerca i Innovació en Salut;17052;Conseller de Salut;Subdirecció General de Recerca i Innovació en Salut;Montserrat Llavayol Giralt;
Agència Tributària de CatalunyaVocal nat - alt càrrec encarregat de l'òrgan del Govern competent en matèria de tributsDirectora general de Tributs i Joc;Agència Tributària de Catalunya;ECF - Departament d'Economia i Finances;Vocal nat - alt càrrec encarregat de l'òrgan del Govern competent en matèria de tributs;Vocal;Directora general de Tributs i Joc;Directora general de Tributs i Joc;1344;;Direcció General de Tributs i Joc;Natàlia Caba Serra;
Fundació Catalana per a la Recerca i la Innovació (FCRi)Titular del dept de l'Admin de la GC amb competència en matèria de recerca o la persona que designiConsellera de Recerca i Universitats;Fundació Catalana per a la Recerca i la Innovació (FCRi);REU - Departament de Recerca i Universitats;Titular del dept de l'Admin de la GC amb competència en matèria de recerca o la persona que designi;President/a;Consellera de Recerca i Universitats;consellera de Recerca i Universitats;21648;Conselleria de Recerca i Universitats;Departament de Recerca i Universitats;Núria Montserrat Pulido;
Institut de Recerca i Tecnologia Agroalimentàries (IRTA)El/la Vicepresident/a - conseller/a del departament competent en matèria de recerca i universitatsConsellera de Recerca i Universitats;Institut de Recerca i Tecnologia Agroalimentàries (IRTA);ARP - Departament d'Agricultura, Ramaderia, Pesca i Alimentació;El/la Vicepresident/a - conseller/a del departament competent en matèria de recerca i universitats;Vicepresident/a;Consellera de Recerca i Universitats;consellera de Recerca i Universitats;21648;;Departament de Recerca i Universitats;Núria Montserrat Pulido;
Consorci de Serveis Universitaris de Catalunya (CSUC)Conseller/a del departament competent en matèria d'universitats o persona que designiConsellera de Recerca i Universitats;Consorci de Serveis Universitaris de Catalunya (CSUC);REU - Departament de Recerca i Universitats;Conseller/a del departament competent en matèria d'universitats o persona que designi;President/a;Consellera de Recerca i Universitats;consellera de Recerca i Universitats;21648;;Departament de Recerca i Universitats;Núria Montserrat Pulido;
Consorci per a la construcció, equipament i explotació del Laboratori de Llum SincrotróDepartament de Recerca i UniversitatsConsellera de Recerca i Universitats;Consorci per a la construcció, equipament i explotació del Laboratori de Llum Sincrotró;REU - Departament de Recerca i Universitats;Departament de Recerca i Universitats;Vicepresident/a;Consellera de Recerca i Universitats;consellera de Recerca i Universitats;21648;;Departament de Recerca i Universitats;Núria Montserrat Pulido;
Institut de Recerca Biomèdica de Lleida, Fundació Dr. PifarréEl/la titular del departament de la Generalitat competent en matèria de recercaConsellera de Recerca i Universitats;Institut de Recerca Biomèdica de Lleida, Fundació Dr. Pifarré;SLT - Departament de Salut;El/la titular del departament de la Generalitat competent en matèria de recerca;Vicepresident/a primer;Consellera de Recerca i Universitats;consellera de Recerca i Universitats;21648;;Departament de Recerca i Universitats;Núria Montserrat Pulido;
Fundació Institut de Recerca contra la Leucèmia Josep CarrerasEl/la titular del departament de la Generalitat competent en matèria de recercaConsellera de Recerca i Universitats;Fundació Institut de Recerca contra la Leucèmia Josep Carreras;SLT - Departament de Salut;El/la titular del departament de la Generalitat competent en matèria de recerca;Vicepresident/a segon;Consellera de Recerca i Universitats;consellera de Recerca i Universitats;21648;;Departament de Recerca i Universitats;Núria Montserrat Pulido;
Fundació Institut de Ciències Fotòniques (ICFO)Conseller/a del departament de la Generalitat en matèria de recerca que en serà presidentConsellera de Recerca i Universitats;Fundació Institut de Ciències Fotòniques (ICFO);REU - Departament de Recerca i Universitats;Conseller/a del departament de la Generalitat en matèria de recerca que en serà president;President/a;Consellera de Recerca i Universitats;consellera de Recerca i Universitats;21648;;Departament de Recerca i Universitats;Núria Montserrat Pulido;
Consorci Porta Diagonal - Campus ClínicLa persona titular del departament competent en matèria de recerca i universitatsConsellera de Recerca i Universitats;Consorci Porta Diagonal - Campus Clínic;PRE - Departament de la Presidència;La persona titular del departament competent en matèria de recerca i universitats;Membre;Consellera de Recerca i Universitats;consellera de Recerca i Universitats;21648;Govern de la Generalitat de Catalunya;Departament de Recerca i Universitats;Núria Montserrat Pulido;
Institut de Física d'Altes Energies (IFAE)La persona titular del departament de la Generalitat competent en recerca, que en serà el presidentConsellera de Recerca i Universitats;Institut de Física d'Altes Energies (IFAE);REU - Departament de Recerca i Universitats;La persona titular del departament de la Generalitat competent en recerca, que en serà el president;President/a;Consellera de Recerca i Universitats;consellera de Recerca i Universitats;21648;;Departament de Recerca i Universitats;Núria Montserrat Pulido;
Consorci Parc de Recerca Biomèdica de Barcelona (PRBB)La presidència que correspon a la persona titular del departament competent en matèria de recercaConsellera de Recerca i Universitats;Consorci Parc de Recerca Biomèdica de Barcelona (PRBB);REU - Departament de Recerca i Universitats;La presidència que correspon a la persona titular del departament competent en matèria de recerca;President/a;Consellera de Recerca i Universitats;consellera de Recerca i Universitats;21648;;Departament de Recerca i Universitats;Núria Montserrat Pulido;
Centre de Recerca en Economia Internacional (CREI)El/la conseller/a del departament competent en matèria de recerca, o la persona en qui deleguiConsellera de Recerca i Universitats;Centre de Recerca en Economia Internacional (CREI);REU - Departament de Recerca i Universitats;El/la conseller/a del departament competent en matèria de recerca, o la persona en qui delegui;President/a;Consellera de Recerca i Universitats;consellera de Recerca i Universitats;21648;;Departament de Recerca i Universitats;Núria Montserrat Pulido;
Centre de Recerca Matemàtica (CRM)La presidència, que correspon al conseller/a competent en matèria de recerca, o en qui deleguiConsellera de Recerca i Universitats;Centre de Recerca Matemàtica (CRM);REU - Departament de Recerca i Universitats;La presidència, que correspon al conseller/a competent en matèria de recerca, o en qui delegui;President/a;Consellera de Recerca i Universitats;consellera de Recerca i Universitats;21648;;Departament de Recerca i Universitats;Núria Montserrat Pulido;
Institut Català d'Arqueologia ClàssicaEl president, que serà la persona titular del departament competent en matèria de recercaConsellera de Recerca i Universitats;Institut Català d'Arqueologia Clàssica;REU - Departament de Recerca i Universitats;El president, que serà la persona titular del departament competent en matèria de recerca;President/a;Consellera de Recerca i Universitats;consellera de Recerca i Universitats;21648;;Departament de Recerca i Universitats;Núria Montserrat Pulido;
Consorci per a l’explotació del Centre Nacional d’Anàlisi Genòmica (CNAG)La persona titular del Departament compet en matèria de recerca, o persona que designiConsellera de Recerca i Universitats;Consorci per a l’explotació del Centre Nacional d’Anàlisi Genòmica (CNAG);REU - Departament de Recerca i Universitats;La persona titular del Departament compet en matèria de recerca, o persona que designi;;Consellera de Recerca i Universitats;consellera de Recerca i Universitats;21648;;Departament de Recerca i Universitats;Núria Montserrat Pulido;
Servei Català de TrànsitLa Presidència que correspon a la persona titular del Departament d'InteriorConsellera d'Interior i Seguretat Pública;Servei Català de Trànsit;ISP - Departament d'Interior i Seguretat Pública;La Presidència que correspon a la persona titular del Departament d'Interior;President/a;Consellera d'Interior i Seguretat Pública;consellera d'Interior i Seguretat Pública;13760;;Departament d'Interior i Seguretat Pública;Núria Parlon Gil;
Institut de Seguretat Pública de CatalunyaPresident/a de l'ISPC que serà el conseller/a competent en seguretat públicaConsellera d'Interior i Seguretat Pública;Institut de Seguretat Pública de Catalunya;ISP - Departament d'Interior i Seguretat Pública;President/a de l'ISPC que serà el conseller/a competent en seguretat pública;President/a;Consellera d'Interior i Seguretat Pública;consellera d'Interior i Seguretat Pública;13760;;Departament d'Interior i Seguretat Pública;Núria Parlon Gil;
Patronat de la Muntanya de MontserratEl/la conseller/a del departament competent en matèria de seguretatConsellera d'Interior i Seguretat Pública;Patronat de la Muntanya de Montserrat;PRE - Departament de la Presidència;El/la conseller/a del departament competent en matèria de seguretat;Vocal;Consellera d'Interior i Seguretat Pública;consellera d'Interior i Seguretat Pública;13760;;Departament d'Interior i Seguretat Pública;Núria Parlon Gil;
Centre d'Atenció i Gestió de Trucades d'Urgència 112 CatalunyaPresident/a que correspon al conseller/a del departament competent en seguretat públicaConsellera d'Interior i Seguretat Pública;Centre d'Atenció i Gestió de Trucades d'Urgència 112 Catalunya;ISP - Departament d'Interior i Seguretat Pública;President/a que correspon al conseller/a del departament competent en seguretat pública;President/a;Consellera d'Interior i Seguretat Pública;consellera d'Interior i Seguretat Pública;13760;;Departament d'Interior i Seguretat Pública;Núria Parlon Gil;
Servei Català de la SalutEl/la conseller/a del departament competent en matèria de salut que serà el president/aConsellera de Salut;Servei Català de la Salut;SLT - Departament de Salut;El/la conseller/a del departament competent en matèria de salut que serà el president/a;President/a;Consellera de Salut;consellera de Salut;2803;President de la Generalitat de Catalunya;Departament de Salut;Olga Pané Mena;
Institut de Recerca Biomèdica de Lleida, Fundació Dr. PifarréEl/la titular del departament de la Generalitat competent en matèria de salutConsellera de Salut;Institut de Recerca Biomèdica de Lleida, Fundació Dr. Pifarré;SLT - Departament de Salut;El/la titular del departament de la Generalitat competent en matèria de salut;President/a;Consellera de Salut;consellera de Salut;2803;;Departament de Salut;Olga Pané Mena;
Fundació Institut de Recerca contra la Leucèmia Josep CarrerasEl/la titular del departament de la Generalitat competent en matèria de salutConsellera de Salut;Fundació Institut de Recerca contra la Leucèmia Josep Carreras;SLT - Departament de Salut;El/la titular del departament de la Generalitat competent en matèria de salut;Vicepresident/a primer;Consellera de Salut;consellera de Salut;2803;;Departament de Salut;Olga Pané Mena;
Consorci Porta Diagonal - Campus ClínicLa persona titular del departament competent en matèria de salutConsellera de Salut;Consorci Porta Diagonal - Campus Clínic;PRE - Departament de la Presidència;La persona titular del departament competent en matèria de salut;Membre;Consellera de Salut;consellera de Salut;2803;Govern de la Generalitat de Catalunya;Departament de Salut;Olga Pané Mena;
Centre d'Atenció i Gestió de Trucades d'Urgència 112 CatalunyaVicepresident/a que correspon al conseller/a competent en matèria de salutConsellera de Salut;Centre d'Atenció i Gestió de Trucades d'Urgència 112 Catalunya;ISP - Departament d'Interior i Seguretat Pública;Vicepresident/a que correspon al conseller/a competent en matèria de salut;Vicepresident/a;Consellera de Salut;consellera de Salut;2803;;Departament de Salut;Olga Pané Mena;
Agrupació Europea de Cooperació Territorial Hospital de la CerdanyaConseller/a de Salut o persona que designiConsellera de Salut;Agrupació Europea de Cooperació Territorial Hospital de la Cerdanya;SLT - Departament de Salut;Conseller/a de Salut o persona que designi;President/a;Consellera de Salut;consellera de Salut;2803;;Departament de Salut;Olga Pané Mena;
Memorial DemocràticEl director/a de l'Arxiu Nacional de CatalunyaDirectora de l'Arxiu Nacional de Catalunya;Memorial Democràtic;JUS - Departament de Justícia i Qualitat Democràtica;El director/a de l'Arxiu Nacional de Catalunya;Membre;Directora de l'Arxiu Nacional de Catalunya;directora de l'Arxiu Nacional de Catalunya;2333;;Arxiu Nacional de Catalunya;Pilar Cuerva Castillo;
Centre de la Propietat ForestalVocal representant dept competent en matèria de desenvolupament rural amb rang mínim SDGDirector General de Desenvolupament Rural;Centre de la Propietat Forestal;ARP - Departament d'Agricultura, Ramaderia, Pesca i Alimentació;Vocal representant dept competent en matèria de desenvolupament rural amb rang mínim SDG;Vocal;Director General de Desenvolupament Rural;director general de Desenvolupament Rural;23560;Conseller/a Agricultura, Ramaderia, Pesca i Alimentació;Direcció General de Desenvolupament Rural;Ramon Armengol Torrent;
Consorci de l'Observatori del PaisatgeAdministració de la Generalitat de CatalunyaDirector General de Desenvolupament Rural;Consorci de l'Observatori del Paisatge;TER - Departament de Territori, Habitatge i Transició Ecològica;Administració de la Generalitat de Catalunya;Membre;Director General de Desenvolupament Rural;director general de Desenvolupament Rural;23560;HC ACC;Direcció General de Desenvolupament Rural;Ramon Armengol Torrent;
Institut de Seguretat Pública de CatalunyaDirector o directora del Servei Català de TrànsitDirector del Servei Català de Trànsit;Institut de Seguretat Pública de Catalunya;ISP - Departament d'Interior i Seguretat Pública;Director o directora del Servei Català de Trànsit;Vocal;Director del Servei Català de Trànsit;director del Servei Català de Trànsit;853;;Servei Català de Trànsit;Ramon Lamiel Villaró;
Institut de Recerca i Tecnologia Agroalimentàries (IRTA)Vocal en representació del departament competent en matèria d'agricultura i alimentacióDirectora general d'Agricultura i Ramaderia;Institut de Recerca i Tecnologia Agroalimentàries (IRTA);ARP - Departament d'Agricultura, Ramaderia, Pesca i Alimentació;Vocal en representació del departament competent en matèria d'agricultura i alimentació;Vocal;Directora general d'Agricultura i Ramaderia;directora general d'Agricultura i Ramaderia;11292;Govern de la Generalitat de Catalunya;Direcció General d'Agricultura i Ramaderia;Rosa Altisent Rosell;
Agència de Residus de CatalunyaRepresentants de la GeneralitatDirectora general d'Agricultura i Ramaderia;Agència de Residus de Catalunya;TER - Departament de Territori, Habitatge i Transició Ecològica;Representants de la Generalitat;Vocal;Directora general d'Agricultura i Ramaderia;directora general d'Agricultura i Ramaderia;11292;Govern de la Generalitat de Catalunya;Direcció General d'Agricultura i Ramaderia;Rosa Altisent Rosell;
Institut Català de la Vinya i el ViEl/la director/a general competent en matèria d'agriculturaDirectora general d'Agricultura i Ramaderia;Institut Català de la Vinya i el Vi;ARP - Departament d'Agricultura, Ramaderia, Pesca i Alimentació;El/la director/a general competent en matèria d'agricultura;Membre;Directora general d'Agricultura i Ramaderia;directora general d'Agricultura i Ramaderia;11292;;Direcció General d'Agricultura i Ramaderia;Rosa Altisent Rosell;
Agència Catalana de l'Aigua (ACA)Representant del departament competent en agricultura i ramaderiaDirectora general d'Agricultura i Ramaderia;Agència Catalana de l'Aigua (ACA);TER - Departament de Territori, Habitatge i Transició Ecològica;Representant del departament competent en agricultura i ramaderia;Vocal;Directora general d'Agricultura i Ramaderia;directora general d'Agricultura i Ramaderia;11292;Conseller de Agricultura, Ramaderia, Pesca i Alimentació;Direcció General d'Agricultura i Ramaderia;Rosa Altisent Rosell;
Consorci Patronat de la Vall de NúriaEl/la President/a de la Generalitat de CatalunyaPresident de la Generalitat de Catalunya;Consorci Patronat de la Vall de Núria;TER - Departament de Territori, Habitatge i Transició Ecològica;El/la President/a de la Generalitat de Catalunya;President/a;President de la Generalitat de Catalunya;President de la Generalitat de Catalunya;15006;;President de la Generalitat;Salvador Illa Roca;
Consorci Institut Europeu de la MediterràniaEl president/a, que serà el president de la GeneralitatPresident de la Generalitat de Catalunya;Consorci Institut Europeu de la Mediterrània;UEX - Departament d'Unió Europea i Acció Exterior;El president/a, que serà el president de la Generalitat;President/a;President de la Generalitat de Catalunya;President de la Generalitat de Catalunya;15006;;President de la Generalitat;Salvador Illa Roca;
Consorci Catalunya InternacionalLa Presidència, que correspon a la persona titular de la Presidència de la Generalitat de CatalunyaPresident de la Generalitat de Catalunya;Consorci Catalunya Internacional;UEX - Departament d'Unió Europea i Acció Exterior;La Presidència, que correspon a la persona titular de la Presidència de la Generalitat de Catalunya;President/a;President de la Generalitat de Catalunya;President de la Generalitat de Catalunya;15006;;President de la Generalitat;Salvador Illa Roca;
Consorci del Gran Teatre del LiceuLa Presidència que correspon al president de la Generalitat de CatalunyaPresident de la Generalitat de Catalunya;Consorci del Gran Teatre del Liceu;CLT - Departament de Cultura;La Presidència que correspon al president de la Generalitat de Catalunya;President/a;President de la Generalitat de Catalunya;President de la Generalitat de Catalunya;15006;;President de la Generalitat;Salvador Illa Roca;
Biocat, la Fundació BioRegió de CatalunyaEl president o presidenta de la Generalitat que exercirà la Presidència del PatronatPresident de la Generalitat de Catalunya;Biocat, la Fundació BioRegió de Catalunya;SLT - Departament de Salut;El president o presidenta de la Generalitat que exercirà la Presidència del Patronat;President/a;President de la Generalitat de Catalunya;President de la Generalitat de Catalunya;15006;;President de la Generalitat;Salvador Illa Roca;
Fundació del Gran Teatre del LiceuLa presidència d'honor que correspon a la presidència de la Generalitat de CatalunyaPresident de la Generalitat de Catalunya;Fundació del Gran Teatre del Liceu;CLT - Departament de Cultura;La presidència d'honor que correspon a la presidència de la Generalitat de Catalunya;President/a d'Honor;President de la Generalitat de Catalunya;President de la Generalitat de Catalunya;15006;;President de la Generalitat;Salvador Illa Roca;
Consorci Casa ÀsiaMembre en representació de la Generalitat de CatalunyaPresident de la Generalitat de Catalunya;Consorci Casa Àsia;UEX - Departament d'Unió Europea i Acció Exterior;Membre en representació de la Generalitat de Catalunya;President/a;President de la Generalitat de Catalunya;President de la Generalitat de Catalunya;15006;Govern de la Generalitat de Catalunya;President de la Generalitat;Salvador Illa Roca;
Consorci del Palau de la Música CatalanaMolt Honorable President de la GeneralitatPresident de la Generalitat de Catalunya;Consorci del Palau de la Música Catalana;CLT - Departament de Cultura;Molt Honorable President de la Generalitat;President/a;President de la Generalitat de Catalunya;President de la Generalitat de Catalunya;15006;;President de la Generalitat;Salvador Illa Roca;
Patronat de la Muntanya de MontserratEl/la President/a del patronat que serà el/la president de la Generalitat de CatalunyaPresident de la Generalitat de Catalunya;Patronat de la Muntanya de Montserrat;PRE - Departament de la Presidència;El/la President/a del patronat que serà el/la president de la Generalitat de Catalunya;President/a;President de la Generalitat de Catalunya;President de la Generalitat de Catalunya;15006;;President de la Generalitat;Salvador Illa Roca;
Consorci de l'Institut Ramon LlullLa presidència que correspon al president/a de la Generalitat o en qui deleguiPresident de la Generalitat de Catalunya;Consorci de l'Institut Ramon Llull;CLT - Departament de Cultura;La presidència que correspon al president/a de la Generalitat o en qui delegui;President/a;President de la Generalitat de Catalunya;President de la Generalitat de Catalunya;15006;;President de la Generalitat;Salvador Illa Roca;
Consorci Porta Diagonal - Campus ClínicPersona titular de la presidència de l'AGC, que exerceix la presidència del Consell GeneralPresident de la Generalitat de Catalunya;Consorci Porta Diagonal - Campus Clínic;PRE - Departament de la Presidència;Persona titular de la presidència de l'AGC, que exerceix la presidència del Consell General;President/a;President de la Generalitat de Catalunya;President de la Generalitat de Catalunya;15006;Govern de la Generalitat de Catalunya;President de la Generalitat;Salvador Illa Roca;
Institut Català del Sòl (INCASÒL)President/a que és el/la titular del departament competent en matèria de territori i obres públiquesConsellera de Territori, Habitatge i Transició Ecològica;Institut Català del Sòl (INCASÒL);TER - Departament de Territori, Habitatge i Transició Ecològica;President/a que és el/la titular del departament competent en matèria de territori i obres públiques;President/a;Consellera de Territori, Habitatge i Transició Ecològica;consellera de Territori, Habitatge i Transició Ecològica;3392;El president de la Generalitat de Catalunya;consellera de Territori, Habitatge i Transició Ecològica;Silvia Paneque Sureda;
