Codificació;denominaci;Departament;membre;c_rrec_en_l_rgan_de_govern_superior;c_rrec_o_lloc_de_treball;SAC.carrec;SAC.codi_d_informaci;rgan_que_designa;SAC;nom_1;Observacions
Fundación Privada Instituto de Salud Global BarcelonaPersona tilular del Departament competent en matèria de recercaConseller de Recerca i Universitats;Fundación Privada Instituto de Salud Global Barcelona;SLT - Departament de Salut;Persona tilular del Departament competent en matèria de recerca;Vocal;Conseller de Recerca i Universitats;#N/D;21648;;#N/D;Joaquim Nadal Farreras;
Fundació The Barcelona Institute of Science and TechnologyDepartament de Recerca i UniversitatsConseller de Recerca i Universitats;Fundació The Barcelona Institute of Science and Technology;REU - Departament de Recerca i Universitats;Departament de Recerca i Universitats;Vocal;Conseller de Recerca i Universitats;#N/D;21648;;#N/D;Joaquim Nadal Farreras;
Fundació Institut de Recerca en Energia de Catalunya (IREC)El/la conseller/a de la Generalitat titular del dep. comp en recerca que serà vicepresident/aConseller de Recerca i Universitats;Fundació Institut de Recerca en Energia de Catalunya (IREC);TER - Departament de Territori, Habitatge i Transició Ecològica;El/la conseller/a de la Generalitat titular del dep. comp en recerca que serà vicepresident/a;Vicepresident/a;Conseller de Recerca i Universitats;#N/D;21648;;#N/D;Joaquim Nadal Farreras;
Barcelona Graduate School of Economics, Fundació PrivadaPresident del Centre de Recerca en Economia Internacional (CREI)Conseller de Recerca i Universitats;Barcelona Graduate School of Economics, Fundació Privada;REU - Departament de Recerca i Universitats;President del Centre de Recerca en Economia Internacional (CREI);Vocal;Conseller de Recerca i Universitats;#N/D;21648;;#N/D;Joaquim Nadal Farreras;
Fundació Institut Hospital del Mar d’Investigacions Mèdiques (IMIM)El/la titular del departament competent en matèria de salutConseller de Salut;Fundació Institut Hospital del Mar d’Investigacions Mèdiques (IMIM);SLT - Departament de Salut;El/la titular del departament competent en matèria de salut;President/a;Conseller de Salut;#N/D;2803;;#N/D;Manel Balcells Díaz;
Fundació Institut d’Investigació en Ciències de la Salut Germans Trias i PujolLa persona titular del depart. de la Generalitat competent en salut a qui correspon la presidènciaConseller de Salut;Fundació Institut d’Investigació en Ciències de la Salut Germans Trias i Pujol;SLT - Departament de Salut;La persona titular del depart. de la Generalitat competent en salut a qui correspon la presidència;President/a;Conseller de Salut;#N/D;2803;;#N/D;Manel Balcells Díaz;
Fundació Institut d'Investigació Sanitària Pere Virgili (IISPV)El/la titular del departament de la Generalitat competent en matèria de salutConseller de Salut;Fundació Institut d'Investigació Sanitària Pere Virgili (IISPV);SLT - Departament de Salut;El/la titular del departament de la Generalitat competent en matèria de salut;President/a;Conseller de Salut;#N/D;2803;;#N/D;Manel Balcells Díaz;
Fundació Ticsalut i SocialConseller/a del departament de la Generalitat competent en matèria de salut que serà president/aConseller de Salut;Fundació Ticsalut i Social;SLT - Departament de Salut;Conseller/a del departament de la Generalitat competent en matèria de salut que serà president/a;President/a;Conseller de Salut;#N/D;2803;;#N/D;Manel Balcells Díaz;
Fundació Institut de Recerca Biomèdica (IRB Barcelona)El/la titular del departament competent en matèria de salut de la Generalitat de CatalunyaConseller de Salut;Fundació Institut de Recerca Biomèdica (IRB Barcelona);REU - Departament de Recerca i Universitats;El/la titular del departament competent en matèria de salut de la Generalitat de Catalunya;President/a;Conseller de Salut;#N/D;2803;;#N/D;Manel Balcells Díaz;
Fundació Privada Institut d'Investigació Oncològica de Vall-Hebron (VHIO)El/la Conseller/a del Departament competent en salut a qui correspondrà la presidènciaConseller de Salut;Fundació Privada Institut d'Investigació Oncològica de Vall-Hebron (VHIO);SLT - Departament de Salut;El/la Conseller/a del Departament competent en salut a qui correspondrà la presidència;President/a;Conseller de Salut;#N/D;2803;;#N/D;Manel Balcells Díaz;
Fundació Institut d’Investigació Biomèdica de Girona Dr. Josep Trueta (IdIBGI)El/la titular del departament de la Generalitat competent en salut que li correspon la presidènciaConseller de Salut;Fundació Institut d’Investigació Biomèdica de Girona Dr. Josep Trueta (IdIBGI);SLT - Departament de Salut;El/la titular del departament de la Generalitat competent en salut que li correspon la presidència;President/a;Conseller de Salut;#N/D;2803;;#N/D;Manel Balcells Díaz;
Fundació Institut d'Investigació Biomèdica de Bellvitge (IDIBELL)El/la titular del depart. de la Generalitat comp. en matèria de salut que ostentarà la presidènciaConseller de Salut;Fundació Institut d'Investigació Biomèdica de Bellvitge (IDIBELL);SLT - Departament de Salut;El/la titular del depart. de la Generalitat comp. en matèria de salut que ostentarà la presidència;President/a;Conseller de Salut;#N/D;2803;;#N/D;Manel Balcells Díaz;
Fundació Institut d'Investigació i Innovació Parc Taulí (I3PT)La persona titular del dep. de la Generalitat en matèria de salut que n'ostentarà la presidènciaConseller de Salut;Fundació Institut d'Investigació i Innovació Parc Taulí (I3PT);SLT - Departament de Salut;La persona titular del dep. de la Generalitat en matèria de salut que n'ostentarà la presidència;President/a;Conseller de Salut;#N/D;2803;;#N/D;Manel Balcells Díaz;
Fundació de Recerca Clínic Barcelona-Institut d’Investigacions Biomèdiques August Pi i Sunyer (FRCB-IDIBAPS)El/la titular del dept de la GC competent en matèria de salut, que és el/la President/aConseller de Salut;Fundació de Recerca Clínic Barcelona-Institut d’Investigacions Biomèdiques August Pi i Sunyer (FRCB-IDIBAPS);SLT - Departament de Salut;El/la titular del dept de la GC competent en matèria de salut, que és el/la President/a;President/a;Conseller de Salut;#N/D;2803;;#N/D;Manel Balcells Díaz;
Fundació Institut de Bioenginyeria de Catalunya (IBEC)El/la titular del Departament competent en matèria de salutConseller de Salut;Fundació Institut de Bioenginyeria de Catalunya (IBEC);REU - Departament de Recerca i Universitats;El/la titular del Departament competent en matèria de salut;President/a;Conseller de Salut;#N/D;2803;;#N/D;Manel Balcells Díaz;
Fundació Privada Institut de Recerca de la Sida - CaixaPresident/a, que és el conseller/a titular del Departament competent en la política sanitàriaConseller de Salut;Fundació Privada Institut de Recerca de la Sida - Caixa;SLT - Departament de Salut;President/a, que és el conseller/a titular del Departament competent en la política sanitària;President/a;Conseller de Salut;#N/D;2803;;#N/D;Manel Balcells Díaz;
Fundación Privada Instituto de Salud Global BarcelonaPersona tilular del Departament competent en matèria de salutConseller de Salut;Fundación Privada Instituto de Salud Global Barcelona;SLT - Departament de Salut;Persona tilular del Departament competent en matèria de salut;Vocal;Conseller de Salut;#N/D;2803;;#N/D;Manel Balcells Díaz;
Fundació per a l'Escola Superior de Música de CatalunyaEl/la conseller/a d'Educació de la Generalitat, que exercirà la presidènciaConseller d'Educació;Fundació per a l'Escola Superior de Música de Catalunya;EDF - Departament d'Educació i Formació Professional;El/la conseller/a d'Educació de la Generalitat, que exercirà la presidència;President/a;Conseller d'Educació;#N/D;1599;;#N/D;Josep Gonzàlez Cambray;
Fundació Jove Orquestra Nacional de CatalunyaEl/la president/a, que serà el/la conseller/a en matèria d'ensenyamentConseller d'Educació;Fundació Jove Orquestra Nacional de Catalunya;EDF - Departament d'Educació i Formació Professional;El/la president/a, que serà el/la conseller/a en matèria d'ensenyament;President/a;Conseller d'Educació;#N/D;1599;;#N/D;Josep Gonzàlez Cambray;
Institut de Recerca i Tecnologia Agroalimentàries (IRTA)El/la president/a de l'IRTA que serà el conseller/a del dep. en matèria d'agricultura i alimentacióConseller del Departament d'Agricultura, Ramaderia, Pesca i Alimentació;Institut de Recerca i Tecnologia Agroalimentàries (IRTA);ARP - Departament d'Agricultura, Ramaderia, Pesca i Alimentació;El/la president/a de l'IRTA que serà el conseller/a del dep. en matèria d'agricultura i alimentació;President/a;Conseller del Departament d'Agricultura, Ramaderia, Pesca i Alimentació;#N/D;4163;;#N/D;Oscar Ordeig Molist;
Institut Català de la Vinya i el ViEl/la president/a, que és el/la conseller/a competent en matèria d'agriculturaConseller del Departament d'Agricultura, Ramaderia, Pesca i Alimentació;Institut Català de la Vinya i el Vi;ARP - Departament d'Agricultura, Ramaderia, Pesca i Alimentació;El/la president/a, que és el/la conseller/a competent en matèria d'agricultura;President/a;Conseller del Departament d'Agricultura, Ramaderia, Pesca i Alimentació;#N/D;4163;;#N/D;Oscar Ordeig Molist;
Fundació Ticsalut i SocialConseller del depart. de la Generalitat competent en matèria de benestar social que serà vicep 2a.Conseller del Departament de Drets Socials;Fundació Ticsalut i Social;SLT - Departament de Salut;Conseller del depart. de la Generalitat competent en matèria de benestar social que serà vicep 2a.;Vicepresident/a segon;Conseller del Departament de Drets Socials;#N/D;19774;;#N/D;Carles Campuzano Canadès;
Institut Català de les Empreses CulturalsPresident - Conseller/a competent en matèria de culturaConseller/a de Cultura;Institut Català de les Empreses Culturals;CLT - Departament de Cultura;President - Conseller/a competent en matèria de cultura;President/a;Conseller/a de Cultura;#N/D;2221;;#N/D;Sònia Hernàndez Almodòvar;
Servei Català de la SalutEl/la conseller/a competent en matèria de salut del Consell General d'AranConsellera d’Igualtat, Salut i Benestar Consell General d'Aran;Servei Català de la Salut;SLT - Departament de Salut;El/la conseller/a competent en matèria de salut del Consell General d'Aran;Vocal;Consellera d’Igualtat, Salut i Benestar Consell General d'Aran;#N/D;21647;;#N/D;Maria Vergès Pérez;
Fundació Antoni TàpiesDepartament de CulturaConsellera de Cultura;Fundació Antoni Tàpies;CLT - Departament de Cultura;Departament de Cultura;Vocal;Consellera de Cultura;#N/D;2221;;consellera de Cultura;Natàlia Garriga Ibáñez;
Consorci del Barri de la MinaLa persona titular del departament competent en l'àmbit dels serveis socials, que és el presidentConsellera del Departament de Drets Socials i Inclusió;Consorci del Barri de la Mina;DSI - Departament de Drets Socials i Inclusió;La persona titular del departament competent en l'àmbit dels serveis socials, que és el president;President/a;Consellera del Departament de Drets Socials i Inclusió;#N/D;19774;;#N/D;Mónica Martínez Bravo;
Consorci Badalona Sud, en liquidacióLa persona titular del departament competent en l'àmbit dels serveis socialsConsellera del Departament de Drets Socials i Inclusió;Consorci Badalona Sud, en liquidació;DSI - Departament de Drets Socials i Inclusió;La persona titular del departament competent en l'àmbit dels serveis socials;President/a;Consellera del Departament de Drets Socials i Inclusió;#N/D;19774;;#N/D;Mónica Martínez Bravo;
Institut Català de l'Acolliment i de l'AdopcióLa Presidència que correspon al conseller o consellera en matèria d'acolliment i adopcióConsellera del Departament de Drets Socials i Inclusió;Institut Català de l'Acolliment i de l'Adopció;DSI - Departament de Drets Socials i Inclusió;La Presidència que correspon al conseller o consellera en matèria d'acolliment i adopció;President/a;Consellera del Departament de Drets Socials i Inclusió;#N/D;19774;;#N/D;Mónica Martínez Bravo;
Agència Catalana de l'Aigua (ACA)President/a - Titular del Departament d’adscripció de l’Agència Catalana de l’AiguaConsellera del Departament de Territori, Habitatge i Transició Ecològica;Agència Catalana de l'Aigua (ACA);TER - Departament de Territori, Habitatge i Transició Ecològica;President/a - Titular del Departament d’adscripció de l’Agència Catalana de l’Aigua;President/a - conseller/a;Consellera del Departament de Territori, Habitatge i Transició Ecològica;#N/D;3392;;#N/D;Silvia Paneque Sureda;
Consorci Centre de Recerca Ecològica i Aplicacions Forestals (CREAF)El/la conseller/a  del dept competent en medi ambientConsellera del Departament de Territori, Habitatge i Transició Ecològica;Consorci Centre de Recerca Ecològica i Aplicacions Forestals (CREAF);TER - Departament de Territori, Habitatge i Transició Ecològica;El/la conseller/a  del dept competent en medi ambient;President/a;Consellera del Departament de Territori, Habitatge i Transició Ecològica;#N/D;3392;;#N/D;Silvia Paneque Sureda;
Agència de Residus de CatalunyaEl president/a, que és el conseller/a del departament competent en matèria de medi ambientConsellera del Departament de Territori, Habitatge i Transició Ecològica;Agència de Residus de Catalunya;TER - Departament de Territori, Habitatge i Transició Ecològica;El president/a, que és el conseller/a del departament competent en matèria de medi ambient;President/a;Consellera del Departament de Territori, Habitatge i Transició Ecològica;#N/D;3392;;#N/D;Silvia Paneque Sureda;
Consorci per a la Protecció i la Gestió dels Espais Naturals del Delta del LlobregatEl/la president/a que correspon al/a la conseller/a del departament competent en medi naturalConsellera del Departament de Territori, Habitatge i Transició Ecològica;Consorci per a la Protecció i la Gestió dels Espais Naturals del Delta del Llobregat;TER - Departament de Territori, Habitatge i Transició Ecològica;El/la president/a que correspon al/a la conseller/a del departament competent en medi natural;President/a;Consellera del Departament de Territori, Habitatge i Transició Ecològica;#N/D;3392;;#N/D;Silvia Paneque Sureda;
Fundació Catalana per a la Recerca i la Innovació (FCRi)Patró designat pel/per la titular departament de la Generalitat competent en recerca, innov.i uniDirector general de Recerca;Fundació Catalana per a la Recerca i la Innovació (FCRi);REU - Departament de Recerca i Universitats;Patró designat pel/per la titular departament de la Generalitat competent en recerca, innov.i uni;Vicepresident/a segon;Director general de Recerca;#N/D;139;Conseller/a en matèria de recerca, innovació i universitats;#N/D;Joan Gómez Pallarès;
Servei Meteorològic de CatalunyaPresident/a que és el conseller/a del Dept. competent en Medi AmbientConsellera del Departament de Territori, Habitatge i Transició Ecològica;Servei Meteorològic de Catalunya;TER - Departament de Territori, Habitatge i Transició Ecològica;President/a que és el conseller/a del Dept. competent en Medi Ambient;President/a;Consellera del Departament de Territori, Habitatge i Transició Ecològica;#N/D;3392;;#N/D;Silvia Paneque Sureda;
Institut Català d'Energia (ICAEN)El president o presidenta, que és el conseller o consellera competent en matèria d'energiaConsellera del Departament de Territori, Habitatge i Transició Ecològica;Institut Català d'Energia (ICAEN);TER - Departament de Territori, Habitatge i Transició Ecològica;El president o presidenta, que és el conseller o consellera competent en matèria d'energia;President/a;Consellera del Departament de Territori, Habitatge i Transició Ecològica;#N/D;3392;;#N/D;Silvia Paneque Sureda;
Fundació Institut Català de Recerca de l'Aigua (ICRA)Patró designat per l'Agència Catalana de l'Aigua (ACA)Director de l'Agència Catalana de l'Aigua;Fundació Institut Català de Recerca de l'Aigua (ICRA);REU - Departament de Recerca i Universitats;Patró designat per l'Agència Catalana de l'Aigua (ACA);Patró;Director de l'Agència Catalana de l'Aigua;#N/D;10647;Agència Catalana de l'Aigua;#N/D;Josep Mª Sangrà i Franci;
Fundació Institut Català de Recerca en Patrimoni Cultural (ICRPC)Vocal designat per la Generalitat, nomenat pel titular del dept. competent en matèria de recercaDirector general de Recerca;Fundació Institut Català de Recerca en Patrimoni Cultural (ICRPC);REU - Departament de Recerca i Universitats;Vocal designat per la Generalitat, nomenat pel titular del dept. competent en matèria de recerca;Vocal;Director general de Recerca;#N/D;139;Conseller/a competent en recerca;#N/D;Joan Gómez Pallarès;
Fundació Centre de Recerca en Agrotecnologia, AGROTECNIOLa persona titular de la direcció general competent en matèria de recerca de l’Administració de la GDirector general de Recerca;Fundació Centre de Recerca en Agrotecnologia, AGROTECNIO;ARP - Departament d'Agricultura, Ramaderia, Pesca i Alimentació;La persona titular de la direcció general competent en matèria de recerca de l’Administració de la G;Vocal;Director general de Recerca;#N/D;139;Institut de Recerca i Tecnologia Agroalimentàries;#N/D;Joan Gómez Pallarès;No coincideix òrgan que el designa amb el càrrec designat
Institut per al Desenvolupament de les Comarques de l'Ebre (IDECE)Representants determinats pel Govern en representació de la GeneralitatDirector de Serveis Territorials d'Acció Climàtica, Alimentació i Agenda Rural a Terres de l'Ebre;Institut per al Desenvolupament de les Comarques de l'Ebre (IDECE);EMT - Departament d'Empresa i Treball;Representants determinats pel Govern en representació de la Generalitat;Vocal;Director de Serveis Territorials d'Acció Climàtica, Alimentació i Agenda Rural a Terres de l'Ebre;#N/D;12219;Govern de la Generalitat de Catalunya;#N/D;Jesús Gómez Fernàndez;
Oficina de Suport a la Iniciativa CulturalVocal representant departament competent en finances públiquesDirectora de Serveis d'Economia i Hisenda;Oficina de Suport a la Iniciativa Cultural;CLT - Departament de Cultura;Vocal representant departament competent en finances públiques;Vocal;Directora de Serveis d'Economia i Hisenda;#N/D;1116;Conseller/a d'Economia i Finances;#N/D;M. Carme Alcaraz Molina;
Fundació Parc Científic de BarcelonaPersona designada per la Generalitat de Catalunya, a través del departament compet en recercaDirector general de Recerca;Fundació Parc Científic de Barcelona;REU - Departament de Recerca i Universitats;Persona designada per la Generalitat de Catalunya, a través del departament compet en recerca;Vocal;Director general de Recerca;#N/D;139;Conseller/a competent en recerca;#N/D;Joan Gómez Pallarès;
Centre de Recerca en Economia Internacional (CREI)Vocal designat pel titular del departament de la Generalitat competent en matèria de recercaDirector general de Recerca;Centre de Recerca en Economia Internacional (CREI);REU - Departament de Recerca i Universitats;Vocal designat pel titular del departament de la Generalitat competent en matèria de recerca;Vocal;Director general de Recerca;#N/D;139;Govern de la Generalitat de Catalunya;#N/D;Joan Gómez Pallarès;
Fundació Centre de Regulació Genòmica (CRG)Vocal designat pel conseller/a del departament que exerceixi les funcions en l'àmbit de recercaDirector general de Recerca;Fundació Centre de Regulació Genòmica (CRG);REU - Departament de Recerca i Universitats;Vocal designat pel conseller/a del departament que exerceixi les funcions en l'àmbit de recerca;Vocal;Director general de Recerca;#N/D;139;Conseller/a d'Empresa i Coneixement;#N/D;Joan Gómez Pallarès;No coincideix òrgan que el designa amb el càrrec designat
Fundació Institut d’Investigació en Ciències de la Salut Germans Trias i PujolMembre designat pel/per la titular del departament de la Generalitat competent en matèria de recercaDirector de la Fundació Institució dels Centres de Recerca de Catalunya;Fundació Institut d’Investigació en Ciències de la Salut Germans Trias i Pujol;SLT - Departament de Salut;Membre designat pel/per la titular del departament de la Generalitat competent en matèria de recerca;Patró;Director de la Fundació Institució dels Centres de Recerca de Catalunya;#N/D;18791;Conseller/a competent en matèria de recerca;#N/D;Lluís Rovira Pato;
Fundació Institut de Ciències Fotòniques (ICFO)Patró designat pel conseller/a del departament competent en matèria de recercaDirector general de Recerca;Fundació Institut de Ciències Fotòniques (ICFO);REU - Departament de Recerca i Universitats;Patró designat pel conseller/a del departament competent en matèria de recerca;Patró;Director general de Recerca;#N/D;139;Conseller/a de Recerca i Universitats;#N/D;Joan Gómez Pallarès;
Fundació Centre de Regulació Genòmica (CRG)Vocal designat pel conseller/a del departament que exerceixi les funcions en l'àmbit de recercaDirector de la Fundació Institució dels Centres de Recerca de Catalunya;Fundació Centre de Regulació Genòmica (CRG);REU - Departament de Recerca i Universitats;Vocal designat pel conseller/a del departament que exerceixi les funcions en l'àmbit de recerca;Vocal;Director de la Fundació Institució dels Centres de Recerca de Catalunya;#N/D;18791;Conseller/a d'Empresa i Coneixement;#N/D;Lluís Rovira Pato;
Institut Català de les Empreses CulturalsDirector/aDirector de l'ICEC;Institut Català de les Empreses Culturals;CLT - Departament de Cultura;Director/a;Vocal;Director de l'ICEC;#N/D;1520;;#N/D;Edgar García Casellas;
Consorci Institut Català d'Avaluació de Polítiques Públiques (Ivàlua)El president/a designat pel departament competent en matèria d'economia i financesDirector de l'IDESCAT;Consorci Institut Català d'Avaluació de Polítiques Públiques (Ivàlua);ECF - Departament d'Economia i Finances;El president/a designat pel departament competent en matèria d'economia i finances;President/a;Director de l'IDESCAT;#N/D;1520;Conseller/a d'Economia i Hisenda;#N/D;Alejandro Costa Sáenz;
Institut d'Estadística de CatalunyaEl/la director/a de l'Idescat.Director de l'Idescat;Institut d'Estadística de Catalunya;ECF - Departament d'Economia i Finances;El/la director/a de l'Idescat.;Vocal;Director de l'Idescat;#N/D;1520;;#N/D;Alejandro Costa Sáenz;
Institut Català del Sòl (INCASÒL)Director/a de l'Institut Català del SòlDirector de l'Institut Català del Sòl;Institut Català del Sòl (INCASÒL);TER - Departament de Territori, Habitatge i Transició Ecològica;Director/a de l'Institut Català del Sòl;Vocal;Director de l'Institut Català del Sòl;#N/D;3738;;#N/D;Agustí Serra Monté;
Autoritat Catalana de Protecció de DadesVocal - El director o directora de l'Institut d'Estadística de CatalunyaDirector de l'Institut d'Estadística de Catalunya;Autoritat Catalana de Protecció de Dades;PRE - Departament de la Presidència;Vocal - El director o directora de l'Institut d'Estadística de Catalunya;Vocal;Director de l'Institut d'Estadística de Catalunya;#N/D;1520;;Director de l'Institut d'Estadística de Catalunya;Alejandro Costa Sáenz;
Fundació Privada Institut d'Investigació Oncològica de Vall-Hebron (VHIO)Persones designades per la persona titular del departament competent en recercaDirector general de Recerca;Fundació Privada Institut d'Investigació Oncològica de Vall-Hebron (VHIO);SLT - Departament de Salut;Persones designades per la persona titular del departament competent en recerca;Vocal;Director general de Recerca;#N/D;139;Conseller/a competent en recerca;#N/D;Joan Gómez Pallarès;
Fundació Institut d'Investigació Biomèdica de Bellvitge (IDIBELL)Persones designades per la persona titular del departament de la Generalitat competent en recercaDirector general de Recerca;Fundació Institut d'Investigació Biomèdica de Bellvitge (IDIBELL);SLT - Departament de Salut;Persones designades per la persona titular del departament de la Generalitat competent en recerca;Patró;Director general de Recerca;#N/D;139;Conseller/a d'Empresa i Coneixement;#N/D;Joan Gómez Pallarès;No coincideix òrgan que el designa amb el càrrec designat
Fundació Privada Espai GuinovartGeneralitat de CatalunyaDirector dels Serveis Territorials a Lleida del Departament de Cultura;Fundació Privada Espai Guinovart;CLT - Departament de Cultura;Generalitat de Catalunya;Vocal;Director dels Serveis Territorials a Lleida del Departament de Cultura;#N/D;2271;Conseller de Cultura;#N/D;Josep Borrell Figuera;
Fundació Observatori de l'EbrePatró designat per la persona titular del departament competent en matèria de medi ambientSecretari de Transició Ecològica;Fundació Observatori de l'Ebre;REU - Departament de Recerca i Universitats;Patró designat per la persona titular del departament competent en matèria de medi ambient;Patró;Secretari de Transició Ecològica;#N/D;18120;Conseller/a Consellera de Territori, Habitatge i Transició Ecològica;secretari de Transició Ecològica;Jordi Sargatal Vicencs;
Institut per al Desenvolupament i la Promoció de l'Alt Pirineu i AranMembre determinat pel Govern en representació de la GeneralitatDirector dels Serveis Territorials d'Empresa i Treball a Lleida (e.f.);Institut per al Desenvolupament i la Promoció de l'Alt Pirineu i Aran;TER - Departament de Territori, Habitatge i Transició Ecològica;Membre determinat pel Govern en representació de la Generalitat;Membre;Director dels Serveis Territorials d'Empresa i Treball a Lleida (e.f.);#N/D;5347;Govern de la Generalitat de Catalunya;#N/D;Vidal Vidal Culleré;
