Codificació;denominaci;Departament;membre;c_rrec_en_l_rgan_de_govern_superior;c_rrec_o_lloc_de_treball;SAC.carrec;SAC.codi_d_informaci;rgan_que_designa;SAC;nom_1;Observacions
Centre d'Alt Rendiment Esportiu (CAR)El/la president/a del CAR que és la persona titular de la secretaria competent en matèria d'esportsSecretari general del Departament d'Esports;Centre d'Alt Rendiment Esportiu (CAR);ESP - Departament d'Esports;El/la president/a del CAR que és la persona titular de la secretaria competent en matèria d'esports;President/a;Secretari general del Departament d'Esports;Secretari general del Departament d'Esports;2558;;Secretaria General d'Esports;Abel García Marín;
Consell Català de l'EsportEl president o presidenta - secretari o secretària general de l'EsportSecretari general del Departament d'Esports;Consell Català de l'Esport;ESP - Departament d'Esports;El president o presidenta - secretari o secretària general de l'Esport;President/a;Secretari general del Departament d'Esports;Secretari general del Departament d'Esports;2558;;Secretaria General d'Esports;Abel García Marín;
Institut Nacional d'Educació Física de CatalunyaVicepresident/-  secretari/ària general de l’EsportSecretari general del Departament d'Esports;Institut Nacional d'Educació Física de Catalunya;ESP - Departament d'Esports;Vicepresident/-  secretari/ària general de l’Esport;Vicepresident/a;Secretari general del Departament d'Esports;Secretari general del Departament d'Esports;2558;;Secretaria General d'Esports;Abel García Marín;
Consorci Catalunya InternacionalEl titular de la secretaria sectorial competent en l'àmbit de l'acció exterior de l'Administració deSecretari d'Afers Europeus, Multilaterals i de Cooperació al Desenvolupament;Consorci Catalunya Internacional;UEX - Departament d'Unió Europea i Acció Exterior;El titular de la secretaria sectorial competent en l'àmbit de l'acció exterior de l'Administració de;Vocal;Secretari d'Afers Europeus, Multilaterals i de Cooperació al Desenvolupament;Secretari d'Afers Europeus, Multilaterals i de Cooperació al Desenvolupament;13801;;Secretaria d'Afers Europeus, Multilaterals i de Cooperació al Desenvolupament;Agustí Fernández de Losada Passols;
Consorci Institut Europeu de la MediterràniaMembres en representació de l'Administració de la Generalitat de CatalunyaSecretari d'Afers Europeus, Multilaterals i de Cooperació al Desenvolupament;Consorci Institut Europeu de la Mediterrània;UEX - Departament d'Unió Europea i Acció Exterior;Membres en representació de l'Administració de la Generalitat de Catalunya;Membre;Secretari d'Afers Europeus, Multilaterals i de Cooperació al Desenvolupament;Secretari d'Afers Europeus, Multilaterals i de Cooperació al Desenvolupament;13801;Govern de la Generalitat de Catalunya;Secretaria d'Afers Europeus, Multilaterals i de Cooperació al Desenvolupament;Agustí Fernández de Losada Passols;
Consorci de l'Institut Ramon LlullRepresentants de l'Administració de la Generalitat de Catalunya designats pel GovernSecretari d'Afers Europeus, Multilaterals i de Cooperació al Desenvolupament;Consorci de l'Institut Ramon Llull;CLT - Departament de Cultura;Representants de l'Administració de la Generalitat de Catalunya designats pel Govern;Vocal;Secretari d'Afers Europeus, Multilaterals i de Cooperació al Desenvolupament;Secretari d'Afers Europeus, Multilaterals i de Cooperació al Desenvolupament;13801;Govern de la Generalitat de Catalunya;Secretaria d'Afers Europeus, Multilaterals i de Cooperació al Desenvolupament;Agustí Fernández de Losada Passols;
Consorci de Serveis Universitaris de Catalunya (CSUC)Membre nomenat pel conseller/a del departament competent en matèria d'universitatsDirectora general de Planificació en Salut;Consorci de Serveis Universitaris de Catalunya (CSUC);REU - Departament de Recerca i Universitats;Membre nomenat pel conseller/a del departament competent en matèria d'universitats;Membre;Directora general de Planificació en Salut;directora general de Planificació en Salut;19031;Conseller d'Empresa i Coneixement;Direcció General de Planificació en Salut;Aina Plaza Tesías;
Fundació Institut d’Investigació en Ciències de la Salut Germans Trias i PujolMembre designat pel/per la titular del departament de la Generalitat competent en matèria de salutDirectora General de Planificació en Salut;Fundació Institut d’Investigació en Ciències de la Salut Germans Trias i Pujol;SLT - Departament de Salut;Membre designat pel/per la titular del departament de la Generalitat competent en matèria de salut;Patró;Directora General de Planificació en Salut;directora general de Planificació en Salut;19031;Conseller/a competent en matèria de salut;Direcció General de Planificació en Salut;Aina Plaza Tesías;
Fundació Institut d'Investigació Biomèdica de Bellvitge (IDIBELL)Persones designades per la persona titular del departament de la Generalitat competent en salutDirectora General de Planificació en Salut;Fundació Institut d'Investigació Biomèdica de Bellvitge (IDIBELL);SLT - Departament de Salut;Persones designades per la persona titular del departament de la Generalitat competent en salut;Vocal;Directora General de Planificació en Salut;directora general de Planificació en Salut;19031;Conseller/a de Salut;Direcció General de Planificació en Salut;Aina Plaza Tesías;
Patronat de la Muntanya de MontserratEl/la Vice-president/a segon/a que serà el/la conseller/a de la Presidència de la GeneralitatConseller de la Presidència;Patronat de la Muntanya de Montserrat;PRE - Departament de la Presidència;El/la Vice-president/a segon/a que serà el/la conseller/a de la Presidència de la Generalitat;Vicepresident/a segon;Conseller de la Presidència;Conseller de la Presidència;6;;Departament de la Presidència;Albert Dalmau Miranda;
Agència de Ciberseguretat de CatalunyaEl/la president/a, que és el conseller/a  del dept competent en mat. de ciberseguretat i societat diConseller de la Presidència;Agència de Ciberseguretat de Catalunya;PRE - Departament de la Presidència;El/la president/a, que és el conseller/a  del dept competent en mat. de ciberseguretat i societat di;President/a;Conseller de la Presidència;Conseller de la Presidència;6;;Departament de la Presidència;Albert Dalmau Miranda;
Centre de Telecomunicacions i Tecnologies de la Informació de la Generalitat de CatalunyaConseller/a titular del departament al qual sigui adscrit el CTTI o persona que aquest designiConseller de la Presidència;Centre de Telecomunicacions i Tecnologies de la Informació de la Generalitat de Catalunya;PRE - Departament de la Presidència;Conseller/a titular del departament al qual sigui adscrit el CTTI o persona que aquest designi;President/a;Conseller de la Presidència;Conseller de la Presidència;6;;Departament de la Presidència;Albert Dalmau Miranda;
Fundació Privada I2CAT, Internet i Innovació Digital a CatalunyaPresident/a. El/la conseller/a competent en telecomunicacions i polítiques digitalsConseller de la Presidència;Fundació Privada I2CAT, Internet i Innovació Digital a Catalunya;PRE - Departament de la Presidència;President/a. El/la conseller/a competent en telecomunicacions i polítiques digitals;President/a;Conseller de la Presidència;Conseller de la Presidència;6;article 10.1.i;Departament de la Presidència;Albert Dalmau Miranda;
Consorci Porta Diagonal - Campus ClínicLa persona titular del dep de la Presidència, que exerceix la vicepresidència del Consell GeneralConseller de la Presidència;Consorci Porta Diagonal - Campus Clínic;PRE - Departament de la Presidència;La persona titular del dep de la Presidència, que exerceix la vicepresidència del Consell General;Vicepresident/a;Conseller de la Presidència;Conseller de la Presidència;6;Govern de la Generalitat de Catalunya;Departament de la Presidència;Albert Dalmau Miranda;
Escola d'Administració Pública de CatalunyaEl/la president/a de l'EscolaConseller de la Presidència;Escola d'Administració Pública de Catalunya;PRE - Departament de la Presidència;El/la president/a de l'Escola;President/a;Conseller de la Presidència;Conseller de la Presidència;6;;Departament de la Presidència;Albert Dalmau Miranda;
Agència de Residus de CatalunyaRepresentants de la GeneralitatDirector de l'Agència de Residus de Catalunya;Agència de Residus de Catalunya;TER - Departament de Territori, Habitatge i Transició Ecològica;Representants de la Generalitat;Vocal;Director de l'Agència de Residus de Catalunya;director de l'Agència de Residus de Catalunya;6341;Govern de la Generalitat de Catalunya;Agència de Residus de Catalunya;Albert Planell Saurí;
Consorci de l'Habitatge de l'Àrea Metropolitana de BarcelonaMembres designats pel govern a proposta de la persona titular del dep.competent en habitatgeDirector de Promoció de l'Habitatge;Consorci de l'Habitatge de l'Àrea Metropolitana de Barcelona;TER - Departament de Territori, Habitatge i Transició Ecològica;Membres designats pel govern a proposta de la persona titular del dep.competent en habitatge;Vocal;Director de Promoció de l'Habitatge;director de Promoció de l'Habitatge;3671;Govern de la Generalitat de Catalunya;Direcció de Promoció de l'Habitatge (Agència de l'Habitatge de Catalunya);Albert Toledo Pascual;
Consorci de l'Habitatge de BarcelonaMembre en representació de la Generalitat de CatalunyaDirector de Promoció de l'Habitatge;Consorci de l'Habitatge de Barcelona;TER - Departament de Territori, Habitatge i Transició Ecològica;Membre en representació de la Generalitat de Catalunya;Membre;Director de Promoció de l'Habitatge;director de Promoció de l'Habitatge;3671;Govern de la Generalitat de Catalunya;Direcció de Promoció de l'Habitatge (Agència de l'Habitatge de Catalunya);Albert Toledo Pascual;
Consorci Administració Oberta de CatalunyaMembre designat pel Govern de la Generalitat, amb rang de secretari o director generalSecretari de Telecomunicacions i Transformació Digital;Consorci Administració Oberta de Catalunya;PRE - Departament de la Presidència;Membre designat pel Govern de la Generalitat, amb rang de secretari o director general;Membre;Secretari de Telecomunicacions i Transformació Digital;secretari de Telecomunicacions i Transformació Digital;22581;Govern de la Generalitat de Catalunya;Secretaria de Telecomunicacions i Transformació Digital;Albert Tort Pugibet;
Centre de Telecomunicacions i Tecnologies de la Informació de la Generalitat de CatalunyaRepresentants de I'Administració de Ia Generalitat de CatalunyaSecretari de Telecomunicacions i Transformació Digital;Centre de Telecomunicacions i Tecnologies de la Informació de la Generalitat de Catalunya;PRE - Departament de la Presidència;Representants de I'Administració de Ia Generalitat de Catalunya;Vicepresident/a segon;Secretari de Telecomunicacions i Transformació Digital;secretari de Telecomunicacions i Transformació Digital;22581;Govern de la Generalitat de Catalunya;Secretaria de Telecomunicacions i Transformació Digital;Albert Tort Pugibet;
Agència de Ciberseguretat de CatalunyaEl secretari o secretària sectorial competent en matèria de polítiques digitals.Secretari de Telecomunicacions i Transformació Digital;Agència de Ciberseguretat de Catalunya;PRE - Departament de la Presidència;El secretari o secretària sectorial competent en matèria de polítiques digitals.;Membre;Secretari de Telecomunicacions i Transformació Digital;secretari de Telecomunicacions i Transformació Digital;22581;;Secretaria de Telecomunicacions i Transformació Digital;Albert Tort Pugibet;
Agrupació Europea de Cooperació Territorial Hospital de la CerdanyaDirector/a del Servei Català de la SalutDirector del Servei Català de la Salut;Agrupació Europea de Cooperació Territorial Hospital de la Cerdanya;SLT - Departament de Salut;Director/a del Servei Català de la Salut;Vocal;Director del Servei Català de la Salut;director del Servei Català de la Salut;3009;;Servei Català de la Salut (CatSalut);Alfredo García Díaz;
Servei Català de la SalutEl/la director/a del Servei Català de la Salut que serà vicepresident/a segon/aDirector del Servei Català de la Salut;Servei Català de la Salut;SLT - Departament de Salut;El/la director/a del Servei Català de la Salut que serà vicepresident/a segon/a;Vicepresident/a segon;Director del Servei Català de la Salut;director del Servei Català de la Salut;3009;;Servei Català de la Salut (CatSalut);Alfredo García Díaz;
Fundació Casa Amèrica CatalunyaPatró designat per l'Administració de la Generalitat de CatalunyaDirectora General de Cooperació al Desenvolupament;Fundació Casa Amèrica Catalunya;UEX - Departament d'Unió Europea i Acció Exterior;Patró designat per l'Administració de la Generalitat de Catalunya;Vocal;Directora General de Cooperació al Desenvolupament;Directora general de Cooperació al Desenvolupament;15754;Govern de la Generalitat de Catalunya;Direcció General de Cooperació al Desenvolupament;Andrea Costafreda Quesada;
Agència Catalana de Cooperació al DesenvolupamentVicepresident/a, titular de DG del dept amb funcions de cooperació al desenvolupament.Directora general de Cooperació al Desenvolupament;Agència Catalana de Cooperació al Desenvolupament;UEX - Departament d'Unió Europea i Acció Exterior;Vicepresident/a, titular de DG del dept amb funcions de cooperació al desenvolupament.;Vicepresident/a;Directora general de Cooperació al Desenvolupament;Directora general de Cooperació al Desenvolupament;15754;;Direcció General de Cooperació al Desenvolupament;Andrea Costafreda Quesada;
Consorci per a la Normalització LingüísticaVocal, fins a un màxim de 10, designat per l’Administració de la GeneralitatDirector dels Serveis Territorials a Barcelona;Consorci per a la Normalització Lingüística;PLG - Departament de Política Lingüística;Vocal, fins a un màxim de 10, designat per l’Administració de la Generalitat;Vocal;Director dels Serveis Territorials a Barcelona;director dels Serveis Territorials a Barcelona;2264;Conseller/a de Cultura;Serveis Territorials a Barcelona del Departament de Cultura;Andreu Felip Ventura;
Consorci per a la Normalització LingüísticaVocal, fins a un màxim de 10, designat per l’Administració de la GeneralitatSubdirector general de Llengües;Consorci per a la Normalització Lingüística;PLG - Departament de Política Lingüística;Vocal, fins a un màxim de 10, designat per l’Administració de la Generalitat;Vocal;Subdirector general de Llengües;Subdirector general de Llengües;13959;Conseller/a de Cultura;Subdirector general de Llengües;Andreu Freixes Gonzàlez;
Agència Tributària de CatalunyaVocal nat - director/a de l'Agència Tributària de CatalunyaDirector de l'Agència Tributària de Catalunya;Agència Tributària de Catalunya;ECF - Departament d'Economia i Finances;Vocal nat - director/a de l'Agència Tributària de Catalunya;Vocal;Director de l'Agència Tributària de Catalunya;director de l'Agència Tributària de Catalunya;16456;;Agència Tributària de Catalunya (ATC);Andreu Navas Amenós;
Escola d'Administració Pública de CatalunyaEl/la director/a general de la Funció Pública de la Generalitat de CatalunyaDirectora general de Funció Pública;Escola d'Administració Pública de Catalunya;PRE - Departament de la Presidència;El/la director/a general de la Funció Pública de la Generalitat de Catalunya;Vicepresident/a;Directora general de Funció Pública;directora general de Funció Pública;12720;;Direcció General de Funció Pública;Anna Maria Molina Cerrato;
Consorci Centre Internacional d'Investigació dels Recursos CostanersAdministració de la Generalitat de CatalunyaDirector General de Política Marítima i Pesca Sostenible;Consorci Centre Internacional d'Investigació dels Recursos Costaners;TER - Departament de Territori, Habitatge i Transició Ecològica;Administració de la Generalitat de Catalunya;Vocal;Director General de Política Marítima i Pesca Sostenible;director general de Política Marítima i Pesca Sostenible;4487;Govern de la Generalitat de Catalunya;Direcció General de Política Marítima i Pesca Sostenible;Antoni Espanya Forcadell;
Consorci Patronat de la Vall de NúriaRepresentant de Ferrocarrils de la Generalitat de CatalunyaPresident del Consell d'Administració de Ferrocarrils de la Generalitat de Catalunya;Consorci Patronat de la Vall de Núria;TER - Departament de Territori, Habitatge i Transició Ecològica;Representant de Ferrocarrils de la Generalitat de Catalunya;Membre;President del Consell d'Administració de Ferrocarrils de la Generalitat de Catalunya;president del Consell d'Administració de Ferrocarrils de la Generalitat de Catalunya;3608;Govern de la Generalitat de Catalunya;Ferrocarrils de la Generalitat de Catalunya (FGC);Carles Ruiz Novella;
Autoritat del Transport Metropolità, Consorci per a la coordinació del sistema metropolità del transport públic de l'àrea de BarcelonaVocals en representació de la Generalitat de CatalunyaPresident del Consell d'Administració de Ferrocarrils de la Generalitat de Catalunya;Autoritat del Transport Metropolità, Consorci per a la coordinació del sistema metropolità del transport públic de l'àrea de Barcelona;TER - Departament de Territori, Habitatge i Transició Ecològica;Vocals en representació de la Generalitat de Catalunya;Vocal;President del Consell d'Administració de Ferrocarrils de la Generalitat de Catalunya;president del Consell d'Administració de Ferrocarrils de la Generalitat de Catalunya;3608;Govern de la Generalitat de Catalunya;Ferrocarrils de la Generalitat de Catalunya (FGC);Carles Ruiz Novella;
Ferrocarrils de la Generalitat de CatalunyaQuatre representants del departament competent en matèria d'infraestructures i mobilitatDirector general de Polítiques de Muntanya;Ferrocarrils de la Generalitat de Catalunya;TER - Departament de Territori, Habitatge i Transició Ecològica;Quatre representants del departament competent en matèria d'infraestructures i mobilitat;Conseller/a;Director general de Polítiques de Muntanya;director general de Polítiques de Muntanya;19852;Govern de la Generalitat de Catalunya;Direcció General de Polítiques de Muntanya;Carlos Guàrdia Carbonell;
Consorci Patronat de la Vall de NúriaRepresentant del departament de la Generalitat competent en matèria de territoriDirector general de Polítiques de Muntanya;Consorci Patronat de la Vall de Núria;TER - Departament de Territori, Habitatge i Transició Ecològica;Representant del departament de la Generalitat competent en matèria de territori;Membre;Director general de Polítiques de Muntanya;director general de Polítiques de Muntanya;19852;Govern de la Generalitat de Catalunya;Direcció General de Polítiques de Muntanya;Carlos Guàrdia Carbonell;
Institut per al Desenvolupament i la Promoció de l'Alt Pirineu i AranMembre determinat pel Govern en representació de la GeneralitatDirector general de Polítiques de Muntanya;Institut per al Desenvolupament i la Promoció de l'Alt Pirineu i Aran;TER - Departament de Territori, Habitatge i Transició Ecològica;Membre determinat pel Govern en representació de la Generalitat;Membre;Director general de Polítiques de Muntanya;director general de Polítiques de Muntanya;19852;Govern de la Generalitat de Catalunya;Direcció General de Polítiques de Muntanya;Carlos Guàrdia Carbonell;
Consorci de l'Aeròdrom de la CerdanyaRepresentant de la Generalitat de Catalunya, designat pel Dept de Territ, Habitatge i Transició EcolDirector general de Polítiques de Muntanya;Consorci de l'Aeròdrom de la Cerdanya;TER - Departament de Territori, Habitatge i Transició Ecològica;Representant de la Generalitat de Catalunya, designat pel Dept de Territ, Habitatge i Transició Ecol;Vocal;Director general de Polítiques de Muntanya;director general de Polítiques de Muntanya;19852;Conseller de TER;Direcció General de Polítiques de Muntanya;Carlos Guàrdia Carbonell;
Centre d'Alt Rendiment Esportiu (CAR)El/la vicepresident/a que és el/la titular de la direcció del Consell Català de l'EsportDirectora del Consell Català de l'Esport;Centre d'Alt Rendiment Esportiu (CAR);ESP - Departament d'Esports;El/la vicepresident/a que és el/la titular de la direcció del Consell Català de l'Esport;Vicepresident/a;Directora del Consell Català de l'Esport;Directora del Consell Català de l'Esport;2570;;Consell Català de l'Esport;Carme Bastida Marco;
Ens d'Abastament d'Aigua Ter-LlobregatUna vocalia del departament competent en matèria de salut, amb rang mínim de sub-direcció generalSubdirectora general de Seguretat Alimentària i Protecció de la Salut;Ens d'Abastament d'Aigua Ter-Llobregat;TER - Departament de Territori, Habitatge i Transició Ecològica;Una vocalia del departament competent en matèria de salut, amb rang mínim de sub-direcció general;Vocal;Subdirectora general de Seguretat Alimentària i Protecció de la Salut;subdirectora general de Seguretat Alimentària i Protecció de la Salut;13566;Govern de la Generalitat de Catalunya;Subdirecció General de Seguretat Alimentària i Protecció de la Salut;Carme Chacón Villanueva;
Oficina de Suport a la Iniciativa CulturalPersones representants direccions generals en què s'estructura departament comp en matèria culturaDirectora general de Cultura Popular i Associacionisme Cultural;Oficina de Suport a la Iniciativa Cultural;CLT - Departament de Cultura;Persones representants direccions generals en què s'estructura departament comp en matèria cultura;Vocal;Directora general de Cultura Popular i Associacionisme Cultural;directora general de Cultura Popular i Associacionisme Cultural;2388;Conseller/a de Cultura;directora general de Cultura Popular i Associacionisme Cultural;Carolina Duran Moreno;
Fundació Mediterrània, Fira d'Espectacles d'Arrel TradicionalDirector/a del Centre de Prom. Cultura Popular i Tradicional Catalana que li correspon la vicep.2a.Directora general de Cultura Popular i Associacionisme Cultural;Fundació Mediterrània, Fira d'Espectacles d'Arrel Tradicional;CLT - Departament de Cultura;Director/a del Centre de Prom. Cultura Popular i Tradicional Catalana que li correspon la vicep.2a.;Vicepresident/a segon;Directora general de Cultura Popular i Associacionisme Cultural;directora general de Cultura Popular i Associacionisme Cultural;2388;;directora general de Cultura Popular i Associacionisme Cultural;Carolina Duran Moreno;
Consorci de l'Auditori i l'OrquestraVocal designat/da pe la persona titular del Departament de CulturaDirectora general de Cultura Popular i Associacionisme Cultural;Consorci de l'Auditori i l'Orquestra;CLT - Departament de Cultura;Vocal designat/da pe la persona titular del Departament de Cultura;Vocal;Directora general de Cultura Popular i Associacionisme Cultural;directora general de Cultura Popular i Associacionisme Cultural;2388;Conseller/a de Cultura;directora general de Cultura Popular i Associacionisme Cultural;Carolina Duran Moreno;
Agència Catalana del Patrimoni CulturalVocals en representació de diversos departaments de la GeneralitatDirectora general de Cultura Popular i Associacionisme Cultural;Agència Catalana del Patrimoni Cultural;CLT - Departament de Cultura;Vocals en representació de diversos departaments de la Generalitat;Membre;Directora general de Cultura Popular i Associacionisme Cultural;directora general de Cultura Popular i Associacionisme Cultural;2388;Conseller/a de Cultura;directora general de Cultura Popular i Associacionisme Cultural;Carolina Duran Moreno;
Fundació Institut Ramon Muntaner. Fundació Privada dels Centres d'Estudis de Parla CatalanaPresident/a a proposta del Departament de Cultura de la Generalitat de CatalunyaDirectora general de Cultura Popular i Associacionisme Cultural;Fundació Institut Ramon Muntaner. Fundació Privada dels Centres d'Estudis de Parla Catalana;CLT - Departament de Cultura;President/a a proposta del Departament de Cultura de la Generalitat de Catalunya;President/a;Directora general de Cultura Popular i Associacionisme Cultural;directora general de Cultura Popular i Associacionisme Cultural;2388;Conseller/a de Cultura;directora general de Cultura Popular i Associacionisme Cultural;Carolina Duran Moreno;
Fundació Casa Amèrica CatalunyaPatró designat per l'Administració de la Generalitat de CatalunyaDirectora general d'Afers Multilaterals;Fundació Casa Amèrica Catalunya;UEX - Departament d'Unió Europea i Acció Exterior;Patró designat per l'Administració de la Generalitat de Catalunya;Patró;Directora general d'Afers Multilaterals;Directora general d'Afers Multilaterals;21048;Govern de la Generalitat de Catalunya;Direcció General d'Afers Multilaterals;Clelia Colombo Vilarrasa;
Agència Catalana de TurismeLa vicepresidència executiva recau en el/la director/a general competent en matèria de turismeDirectora general de Turisme;Agència Catalana de Turisme;EMT - Departament d'Empresa i Treball;La vicepresidència executiva recau en el/la director/a general competent en matèria de turisme;Vicepresident/a executiu/va;Directora general de Turisme;directora general de Turisme;5483;;Direcció General de Turisme;Cristina Lagé Manich;
Consorci Museu Nacional d'Art de CatalunyaVocals nomenats per la Generalitat de CatalunyaDirectora general de Turisme;Consorci Museu Nacional d'Art de Catalunya;CLT - Departament de Cultura;Vocals nomenats per la Generalitat de Catalunya;Vocal;Directora general de Turisme;directora general de Turisme;5483;Conseller/a de Cultura;Direcció General de Turisme;Cristina Lagé Manich;
